[
  {
    "contract_version": "1.0.0",
    "shop_domain": "priceflag-demo.myshopify.com",
    "variant_gid": "gid://shopify/ProductVariant/46100000000",
    "elasticity": -1.5397200939383935,
    "se": 0.6476164695534916,
    "n_obs": 170,
    "price_variation_pct": 8.614552428186515,
    "confidence": "partial",
    "confidence_explanation": "Partly measured from this store's data (its sales moved oddly around price changes), partly based on similar products in your catalog.",
    "method": "poisson_irls_eb_shrunk",
    "shrinkage_weight": 0.17805246972787192,
    "prior_elasticity": -1.8732583738388109,
    "model_version": "elasticity-poisson-eb-1.0",
    "fitted_at": "2026-07-29T12:00:00.000Z",
    "window_start": "2026-01-31",
    "window_end": "2026-07-29"
  },
  {
    "contract_version": "1.0.0",
    "shop_domain": "priceflag-demo.myshopify.com",
    "variant_gid": "gid://shopify/ProductVariant/46100000023",
    "elasticity": -1.977546349674753,
    "se": 0.6699499118147189,
    "n_obs": 168,
    "price_variation_pct": 8.427683663914191,
    "confidence": "partial",
    "confidence_explanation": "Partly measured from this store's data (its day-to-day sales are too variable for a precise read), partly based on similar products in your catalog.",
    "method": "poisson_irls_eb_shrunk",
    "shrinkage_weight": 0.13403920188093785,
    "prior_elasticity": -1.8732583738388109,
    "model_version": "elasticity-poisson-eb-1.0",
    "fitted_at": "2026-07-29T12:00:00.000Z",
    "window_start": "2026-01-31",
    "window_end": "2026-07-29"
  },
  {
    "contract_version": "1.0.0",
    "shop_domain": "priceflag-demo.myshopify.com",
    "variant_gid": "gid://shopify/ProductVariant/46100000046",
    "elasticity": -1.8363109135530407,
    "se": 0.6387193971200618,
    "n_obs": 170,
    "price_variation_pct": 12.746801719225056,
    "confidence": "partial",
    "confidence_explanation": "Partly measured from this store's data (its day-to-day sales are too variable for a precise read), partly based on similar products in your catalog.",
    "method": "poisson_irls_eb_shrunk",
    "shrinkage_weight": 0.19546304331738285,
    "prior_elasticity": -1.8732583738388109,
    "model_version": "elasticity-poisson-eb-1.0",
    "fitted_at": "2026-07-29T12:00:00.000Z",
    "window_start": "2026-01-31",
    "window_end": "2026-07-29"
  },
  {
    "contract_version": "1.0.0",
    "shop_domain": "priceflag-demo.myshopify.com",
    "variant_gid": "gid://shopify/ProductVariant/46100000069",
    "elasticity": -1.7520590773986715,
    "se": 0.6201994616128363,
    "n_obs": 169,
    "price_variation_pct": 11.172078798236933,
    "confidence": "partial",
    "confidence_explanation": "Partly measured from this store's data (its day-to-day sales are too variable for a precise read), partly based on similar products in your catalog.",
    "method": "poisson_irls_eb_shrunk",
    "shrinkage_weight": 0.2314668632192288,
    "prior_elasticity": -1.8732583738388109,
    "model_version": "elasticity-poisson-eb-1.0",
    "fitted_at": "2026-07-29T12:00:00.000Z",
    "window_start": "2026-01-31",
    "window_end": "2026-07-29"
  },
  {
    "contract_version": "1.0.0",
    "shop_domain": "priceflag-demo.myshopify.com",
    "variant_gid": "gid://shopify/ProductVariant/46100000092",
    "elasticity": -1.2,
    "se": null,
    "n_obs": 172,
    "price_variation_pct": 0,
    "confidence": "assumption",
    "confidence_explanation": "This product's price hasn't changed outside promotions, so its price sensitivity can't be measured yet — using a standard assumption.",
    "method": "poisson_irls_eb_shrunk",
    "shrinkage_weight": null,
    "prior_elasticity": null,
    "model_version": "elasticity-poisson-eb-1.0",
    "fitted_at": "2026-07-29T12:00:00.000Z",
    "window_start": "2026-01-31",
    "window_end": "2026-07-29"
  },
  {
    "contract_version": "1.0.0",
    "shop_domain": "priceflag-demo.myshopify.com",
    "variant_gid": "gid://shopify/ProductVariant/46100000115",
    "elasticity": -1.8901122644937056,
    "se": 0.6925066567229426,
    "n_obs": 172,
    "price_variation_pct": 7.836423225553981,
    "confidence": "partial",
    "confidence_explanation": "Partly measured from this store's data (its day-to-day sales are too variable for a precise read), partly based on similar products in your catalog.",
    "method": "poisson_irls_eb_shrunk",
    "shrinkage_weight": 0.08916208945524895,
    "prior_elasticity": -1.8732583738388109,
    "model_version": "elasticity-poisson-eb-1.0",
    "fitted_at": "2026-07-29T12:00:00.000Z",
    "window_start": "2026-01-31",
    "window_end": "2026-07-29"
  },
  {
    "contract_version": "1.0.0",
    "shop_domain": "priceflag-demo.myshopify.com",
    "variant_gid": "gid://shopify/ProductVariant/46100000138",
    "elasticity": -1.2,
    "se": null,
    "n_obs": 168,
    "price_variation_pct": 0,
    "confidence": "assumption",
    "confidence_explanation": "This product's price hasn't changed outside promotions, so its price sensitivity can't be measured yet — using a standard assumption.",
    "method": "poisson_irls_eb_shrunk",
    "shrinkage_weight": null,
    "prior_elasticity": null,
    "model_version": "elasticity-poisson-eb-1.0",
    "fitted_at": "2026-07-29T12:00:00.000Z",
    "window_start": "2026-01-31",
    "window_end": "2026-07-29"
  },
  {
    "contract_version": "1.0.0",
    "shop_domain": "priceflag-demo.myshopify.com",
    "variant_gid": "gid://shopify/ProductVariant/46100000161",
    "elasticity": -1.2,
    "se": null,
    "n_obs": 172,
    "price_variation_pct": 0,
    "confidence": "assumption",
    "confidence_explanation": "This product's price hasn't changed outside promotions, so its price sensitivity can't be measured yet — using a standard assumption.",
    "method": "poisson_irls_eb_shrunk",
    "shrinkage_weight": null,
    "prior_elasticity": null,
    "model_version": "elasticity-poisson-eb-1.0",
    "fitted_at": "2026-07-29T12:00:00.000Z",
    "window_start": "2026-01-31",
    "window_end": "2026-07-29"
  },
  {
    "contract_version": "1.0.0",
    "shop_domain": "priceflag-demo.myshopify.com",
    "variant_gid": "gid://shopify/ProductVariant/46100000184",
    "elasticity": -1.909549395002782,
    "se": 0.715600668980159,
    "n_obs": 172,
    "price_variation_pct": 5.761252833765399,
    "confidence": "partial",
    "confidence_explanation": "Partly measured from this store's data (its day-to-day sales are too variable for a precise read), partly based on similar products in your catalog.",
    "method": "poisson_irls_eb_shrunk",
    "shrinkage_weight": 0.042805588249585795,
    "prior_elasticity": -1.8732583738388109,
    "model_version": "elasticity-poisson-eb-1.0",
    "fitted_at": "2026-07-29T12:00:00.000Z",
    "window_start": "2026-01-31",
    "window_end": "2026-07-29"
  },
  {
    "contract_version": "1.0.0",
    "shop_domain": "priceflag-demo.myshopify.com",
    "variant_gid": "gid://shopify/ProductVariant/46100000207",
    "elasticity": -1.9343097621218621,
    "se": 0.7182165477901176,
    "n_obs": 172,
    "price_variation_pct": 11.4499402444196,
    "confidence": "partial",
    "confidence_explanation": "Partly measured from this store's data (its day-to-day sales are too variable for a precise read), partly based on similar products in your catalog.",
    "method": "poisson_irls_eb_shrunk",
    "shrinkage_weight": 0.03752986171941832,
    "prior_elasticity": -1.8732583738388109,
    "model_version": "elasticity-poisson-eb-1.0",
    "fitted_at": "2026-07-29T12:00:00.000Z",
    "window_start": "2026-01-31",
    "window_end": "2026-07-29"
  },
  {
    "contract_version": "1.0.0",
    "shop_domain": "priceflag-demo.myshopify.com",
    "variant_gid": "gid://shopify/ProductVariant/46100000230",
    "elasticity": -1.2,
    "se": null,
    "n_obs": 168,
    "price_variation_pct": 0,
    "confidence": "assumption",
    "confidence_explanation": "This product's price hasn't changed outside promotions, so its price sensitivity can't be measured yet — using a standard assumption.",
    "method": "poisson_irls_eb_shrunk",
    "shrinkage_weight": null,
    "prior_elasticity": null,
    "model_version": "elasticity-poisson-eb-1.0",
    "fitted_at": "2026-07-29T12:00:00.000Z",
    "window_start": "2026-01-31",
    "window_end": "2026-07-29"
  },
  {
    "contract_version": "1.0.0",
    "shop_domain": "priceflag-demo.myshopify.com",
    "variant_gid": "gid://shopify/ProductVariant/46100000253",
    "elasticity": -1.7896824702774865,
    "se": 0.6315417539437901,
    "n_obs": 172,
    "price_variation_pct": 10.575793184488838,
    "confidence": "partial",
    "confidence_explanation": "Partly measured from this store's data (its day-to-day sales are too variable for a precise read), partly based on similar products in your catalog.",
    "method": "poisson_irls_eb_shrunk",
    "shrinkage_weight": 0.2094555648895515,
    "prior_elasticity": -1.8732583738388109,
    "model_version": "elasticity-poisson-eb-1.0",
    "fitted_at": "2026-07-29T12:00:00.000Z",
    "window_start": "2026-01-31",
    "window_end": "2026-07-29"
  },
  {
    "contract_version": "1.0.0",
    "shop_domain": "priceflag-demo.myshopify.com",
    "variant_gid": "gid://shopify/ProductVariant/46100000276",
    "elasticity": -1.2,
    "se": null,
    "n_obs": 177,
    "price_variation_pct": 0,
    "confidence": "assumption",
    "confidence_explanation": "This product's price hasn't changed outside promotions, so its price sensitivity can't be measured yet — using a standard assumption.",
    "method": "poisson_irls_eb_shrunk",
    "shrinkage_weight": null,
    "prior_elasticity": null,
    "model_version": "elasticity-poisson-eb-1.0",
    "fitted_at": "2026-07-29T12:00:00.000Z",
    "window_start": "2026-01-31",
    "window_end": "2026-07-29"
  },
  {
    "contract_version": "1.0.0",
    "shop_domain": "priceflag-demo.myshopify.com",
    "variant_gid": "gid://shopify/ProductVariant/46100000299",
    "elasticity": -1.2,